{
  "schema": 1,
  "kind": "export",
  "fidelity": "heuristic-unverified",
  "provenance": {
    "source": "steam-appinfo",
    "seeded_at": "2026-08-12T00:00:00Z"
  },
  "game": {
    "id": "palworld",
    "name": "Palworld"
  },
  "stage": [
    {
      "role": "client",
      "lifecycle": "session",
      "match": {
        "exe": "Palworld-Win64-Shipping.exe"
      }
    }
  ]
}
